classlabel,content
4,वाणिज्य बैंक गाभिँदैनेपाल इन्डस्टि्रयल एन्ड कमर्सियल बैंक एनआईसी बैंक अफ एसिया नेपाल बीओए गाभिने नेपाल इन्डस्टि्रयल एन्ड कमर्सियल बैंक एनआईसी बैंक अफ एसिया नेपाल बीओए गाभिने वाणिज्य बैंक गाभिन लागे पुस मर्जर काम सक्ने दुवै संस्था समझदारी राष्ट्र बैंक मर्जर प्रोत्साहन दिने एकै प्रवर्द्धक रहे संस्था दबाब दिने नीति सँगै बैक गाभिने तयारी महिना अघि राष्ट्र बैंक दुवै संस्था प्रवर्द्धक बोलाएर मर्जर सुझाव त्यस दुवै संस्था अन्तर्राष्ट्रिय साझेदार खोजि दुवै संस्था जना प्रवर्द्धक साझा पारिवारिक सम्बन्ध स्थापित गर्दा संख्या अझ बढ्छ दुवै संस्था अन्तर्राष्ट्रिय मर्जर प्रयास गरे एनआईसी बैंक प्रमुख कार्यकारी अधिकृत ससिन जोशी दुवै बैंक गाभिए अन्तर्राष्ट्रिय संस्था खोजी जारी रहने उन बताए बैंक मर्ज भइसक्ने पुँजी अर्ब हाराहारी पुग्ने जोशी बताए दुवै बैंक छिट्टै मर्जर अघि बढाउन राष्ट्र बैंक बाट आगामी साता सहमति माग्ने राष्ट्र बैंक बाट मर्जर सैद्धान्तिक सहमति संस्था विस्तृत वित्तीय अध्ययन गरिने जोशी बताए अध्ययन बन्ने बैंक पुँजीगत संरचना निर्धारण गरिने एनआईसी चुक्ता पुँजी अर्ब करोड रुपैयाँ बीओए अर्ब रुपैयाँ चुक्ता पुँजी न्यूनतम अर्ब करोड बीओए कार्यालय सहित शाखा एनआईसी शाखा दुवै बैंक मिलाएर कर्मचारी संख्या सय मर्जर सञ्जाल प्रमुख निजी बैंक जोशी एनआईसी बैंक सञ्चालक राजेन्द्र अर्याल संयोजकत्व लोकमान्य गोल्छा ससिन जोशी हिमबहादुर रावल सतीशकुमार मोर लक्ष्मण रिसाल रहे संयुक्त मर्जर समिति बनाइए एनआईसी बैंक प्रवर्द्धक सर्वसाधारण प्रतिशत लगानी बैंक अफ एसिया प्रतिशत प्रवर्द्धक प्रतिशत सर्वसाधारण लगानी करिब दिन अघि दुवै बैंक ठूला प्रवर्द्धक बसेर मर्जर सम्बन्धी अघि बढाए मर्जर जाने भनेर दिन छलफल थाले अर्याल दुवै तर्फ एकै सोच व्यक्ति बलियो बैंक बनाएर अघि बढौं सहमति मुलुक अर्थतन्त्र बैंक संख्या कारण मर्जर अघि बढे उनी बताउँछन् वाणिज्य बैंक हरू मर्जर जाँदै उन नहुने सोच सञ्चालक विवाद नभए आगामी दिन नहुने उनी बताउँछन् दुवै बैंक शाखा सञ्चालन रहने कर्मचारी कटौती नहुने अर्याल बताए आवश्यक परे स्थान शाखा स्थानान्तरण उन ठूला सहर हाल दुवै शाखा सञ्चालन हुन्छन् मर्जर जाने तयारी थालिए दुवै संस्था जानकारी नेपाल स्टक एक्सचेन्ज नेप्से पठाए सूचना नेप्से दुवै संस्था कारोबार मर्जर नभए रोक्का तथ्यांक एनआईसी बैंक प्रतिकित्ता सेयर मूल्य सय रुपैयाँ बीओए सय रुपैयाँ एनआईसी साउन क्षेत्रीय वाणिज्य बैंक विराटनगर स्थापना विशाल त्रिवेणी गोल्छा गोल्यान समूह राष्ट्रिय वाणिज्य बैंक लगानी स्थापना स्थापना हुँदा चुक्ता पुँजी करोड राष्ट्रिय स्तर बैंक काम थप करोड लगानी वाणिज्य बैंक बैंक अफ एसिया वाणिज्य बैंक असोज सञ्चालन दुवै बैंक रहे एकै प्रवर्द्धक लगानी नाम एनआईसी बीओए त्रिलोकचन्द अग्रवाल दशमलव प्रतिशत गोविन्दलाल संघाई दशमलव दशमलव तुलसीराम अग्रवाल दशमलव दशमलव जगदीशप्रसाद अग्रवाल दशमलव दशमलव विशाल अग्रवाल दशमलव प्रतिशत अनुज अग्रवाल दशमलव प्रतिशत अशोककुमार अग्रवाल दशमलव दशमलव निर्मलकुमार अग्रवाल दशमलव दशमलव निकुञ्ज अग्रवाल दशमलव दशमलव स्रोत सम्बन्धित बैंक वाषिर्क प्रतिवेदन
4,लुम्बिनी सिलिन्डर केजी कम ग्यासवाणिज्य विभाग गुणस्तर नापतौल विभाग गरे छुट्टाछुट्टै अनुगमन लुम्बिनी ग्यास तौल कम फेला पारे वाणिज्य विभाग गुणस्तर नापतौल विभाग गरे छुट्टाछुट्टै अनुगमन लुम्बिनी ग्यास तौल कम फेला पारे निकाय गरे अनुगमन क्रम सिलिन्डर सय सय ग्राम तौल कम सिलिन्डर भेटिए वाणिज्य गुणस्तर वटा कम तौल सिलिन्डर कब्जा लिएर छानबिन सुरु गरे सय ग्राम सय ग्राम तौल कम वटा सिलिन्डर कब्जा लियौं अनुगमन वाणिज्य शाखा अधिकृत शरद उप्रेती वाणिज्य टोली सिल नखोलिए अवस्था सिलिन्डर कब्जा लिए उप्रेती विभाग लुम्बिनी ग्यास सञ्चालक कालोबजारी गरे आधार कारबाही अगाडि बढ्न सक्ने बताए उता गुणस्तर गोंगबु स्थित देवकोटा ग्यास स्टोर बाट सय ग्राम सय ग्राम तौल कम थान सिलिन्डर कब्जा लिए उक्त स्टोर सञ्चालक ग्यास बिक्रेता महासंघ कावा अध्यक्ष अर्जुन देवकोटा मै शनिबार थान लुम्बिनी ग्यास ल्याए थिएँ उन उपभोक्ता पूरा तौल ग्यास दिने सरकारी योजना आइतबार मै मगाए तराजु आइपुग्यो त्यस ग्यास तौलँदा कम भयो गुणस्तर खबर गरे हुँ लुम्बिनी ग्यास सञ्चालक सुरेश प्रजापति ग्यास तौल कम स्विकारे ग्यास तौल कम कै उन सिलिन्डर फर्काइदिनुहोस् नोक्सानी बेहोर्छु देवकोटा जीले कारबाही प्रक्रिया लैजानुभएछ बाट सिलिन्डर तौल कम भो शं लागे आज कहिल्यै तौल कम गुणस्तर महानिर्देशक रामआधार साह देवकोटा ग्यास स्टोर बाट कम तौल लुम्बिनी ग्यास वटा सिलिन्डर कब्जा लिए बताए तौल सय ग्राम कम सिलिन्डर कब्जा लिए उन बद्मासी कम्पनी डिपो पत्ता लगाउन अनुसन्धान गछौर्ं दोषी कारबाही गछौर्ं देवकोटा उन स्टोर बाट गुणस्तर कब्जा लिए सिलिन्डर मध्ये थान घाँटी ग्यास लिकेज भइ थान पिँध गृहलक्ष्मी ग्यास उल्लेख गरिए लुम्बिनी ग्यास सिल सिलिन्डर
0,﻿राजविराज ७ माघ लिटिल फ्लावर सेकेण्ड्री स्कूल विहीवार विद्यालय परिसर ९औं यशोदा स्मृति भलिवल रनिङ्ग ट्रफी आयोजना गरे विद्यालय निर्देशक राष्ट्रिय योजना आयोग सदस्य डा. कामानन्द देव अध्यक्षता आयोजित ट्रफी प्रमुख अतिथि वरिष्ठ पत्रकार शिवहरि प्रसाद भट्टराई उद्घाटन गरे उद्घाटन समारोह नेपाल पत्रकार महासंघ सप्तरी अध्यक्ष व्यासशंकर उपाध्याय कार्यवाहक अध्यक्ष श्रवण कुमार देव ईन्सेक सप्तरी प्रतिनीधि मनोहर कुमार पोखरेल संघीय प्रेस फोरम सप्तरी अध्यक्ष श्यामसुन्दर यादव लगायतको उपस्थिति विद्यालय प्रमुख लेखापाल सन्तोष देव स्वागत गरे कार्यक्रम सञ्चालन संस्थापक प्रिन्सिपल नन्दलाल आचार्य गरे विद्यालय की संस्थापि स्व. यशोदा देवी देव स्मृति २०६५ साल विद्यालय कार्यक्रम गर्दैआए निर्देशक देव जानकारी
3,फेक न्यूज अफवाह हरु भाइरल गुनासा उजुरी हरु यस्ता घटना हरुका कारण आलोचित बनि फेसबुक बेलायत विरुद्ध लड्न सहकार्य सुरु गरे बेलायत स्वतन्त्र च्यारिटी संस्था फुल फ्याक्ट सँगको सहकार्य फेसबुक फेक न्यूजविरुद्ध संघर्ष सुरु गरे समाचार फेसबुक सोसल नेटवर्क आउने फेक न्यूज पोष्टहरु विरुद्ध सत्यता परीक्षण फ्याक्ट चेकिङ्ग कारवाही सुरु गर्नेछ अघि द गार्जियन एउटा खबर छापिए जस फेसबुक सहकार्यमार्फत् सोसल नेटवर्क आउने सामग्री सत्यता तथ्य जाँच समीक्षा उल्लेख गरिए तथ्य जाँचकी टोली फेसबुक भाइरल तस्वीर भिडियो तथ्य हरुको जाँच गर्नेछ त्यस्ता सामाग्री हरु झूट अफवाह नभए पत्ता लगाउनेछ जाँच हुँदा पोष्ट हरु अफवाह झूटो पाइए त्यस बारेमा सम्बन्धित फेसबुक प्रयोगकर्ता जानकारी गराइनेछ फेसबुक प्रयोगकर्ता त्यस्ता सामग्री पढ्ने शेयर बाट रोक्ने प्रणाली फेसबुक बनाउने फेसबुक न्यूजफिड एल्गोरिदम फेक सामग्री हरुलाई प्रयोगकर्ता पुग्न बाट रोक्ने गर्दछ फ्याक्ट चेकिंग लामो काम जाँचकी हरुको टोली स्तर बाट काम सुरु सकेको बताइए
4,डलर बढ्दा अर्ब फाइदाअमेरि की डलर अधिमूल्यन भाउ बढ्नु कारण आर्थिक वर्ष महिना मुलुक करिब अर्ब रुपैयाँ अर्ब भारु फाइदा राष्ट्र बैंक डलर तिरेर भारतीय रुपैयाँ भारु किन्दा उक्त फाइदा होअमेरि की डलर अधिमूल्यन भाउ बढ्नु कारण आर्थिक वर्ष महिना मुलुक करिब अर्ब रुपैयाँ अर्ब भारु फाइदा राष्ट्र बैंक डलर तिरेर भारतीय रुपैयाँ भारु किन्दा उक्त फाइदा मुलुक आवश्यक भारु नेपाल राष्ट्र बैंक डलर बिक्री किन्छ गत आर्थिक वर्ष महिना राष्ट्र बैंक अर्ब करोड अमेरि की डलर बिक्री खर्ब अर्ब करोड भारतीय रुपैयाँ खरिद गरे अघिल्लो वर्ष अवधि करिब त्यति अमेरि की डलर बिक्री गर्दा खर्ब अर्ब करोड भारु किनिए अमेरि की डलर भारत बलियो पछिको फाइदा नेपाल पुगे स्थिर विनिमय दर रहे कारण भारत सँगै नेपाल अमेरि की डलर तलमाथि नेपाल आवश्यक पर्दा भारत बाट डलर बिक्री भारु ल्याउने प्रचलन प्रयोग आयात भुक्तानी व्यापार ठूलो साझेदार भारत सँग नगद खरिद गर्दा फाइदा हालसम्म कै उच्च सक्ने अनुमान गरिए कुल अन्तर्राष्ट्रिय व्यापार भारत हिस्सा प्रतिशत कुल आयात करिब प्रतिशत अवैध आयात अनुमान आधार ठूलै नगद भारु माग मुलुक समीक्षा गरिए महिना अवधि अमेरि की डलर मूल्य नेपाल रुपैयाँ पैसा बढे साउन रुपैयाँ हाराहारी रहे अमेरि की डलर त्यस वर्ष रुपैयाँ पैसा पुगे रुपैयाँ हाराहारी मै युरोप देखिए आर्थिक संकट अमेरि की डलर बलियो क्रम बढे अन्तर्राष्ट्रिय असर भारत बढ्दो पेट्रोलियम माग घट्दो विदेशी लगानी कारण डलर मूल्य बढे भारत अमेरि की डलर प्रयोग पेट्रोलियम पदार्थ खरिद भारत लगानी गरे विदेशी कम्पनी नाफा लगानी फिर्ता लैजाने क्रम डलर मूल्य बढ्न सहयोग पुगे भारत सँग स्थिर विनिमय दर कारण नेपाल डलर भाउ बढे वर्ष अमेरि की डलर मूल्य परिवर्तन मुलुक फाइदा बेफाइदा दुवै अमेरि की डलर बलियो हुँदा स्वदेशी निर्यातजन्य उद्योग मूल्य कारण प्रतिस्पर्धात्मक क्षमता बढाउन सहयोग पुग्छ विशेषगरी गलैंचा हस्तकला गार्मेन्ट लगायत उद्योग बढे डलर कारण बढी कमाउन सहयोग पुग्छ डलर रेमिट्यान्स आउने क्रम सहयोग तर्फ सरकार लिए विदेशी ऋण महँगो आयात मुखी अर्थतन्त्र कारण महँगी बढ्न जान्छ स्वदेश रहे कच्चा पदार्थ आयात उद्योग डलर अस्थिर मूल्य कारण असर विदेश यात्रा जाने बढी रुपैयाँ तिरेर डलर खरिद पर्ने बाध्यता राष्ट्र बैंक खरिद ल्याउने भारतीय रुपैयाँ मौज्दात रकम
2,विद्या रणवीर अब्बलदक्षिण भारत की विवादास्पद आइटम डान्सर सिल्क स्मिता जीवनी फिल्म बन्ने नायिका कंगना रानावत अफर गरिए दक्षिण भारत की विवादास्पद आइटम डान्सर सिल्क स्मिता जीवनी फिल्म बन्ने नायिका कंगना रानावत अफर गरिए अश्लील लाग्ने खाल उक्त भूमिका कंगना इन्कार गरिदिए द डर्टी पिक्चर विद्या बालन भाग्य खुले भाग्य उन फिल्म रिलिज छोडेन उक्त भूमिका कै शारीरिक वजन समेत बढाए की विद्या दिलोज्यान लगाएर पात्र न्याय गरिन् विद्या कै अभिनय सी ग्रेड फिल्म ए ग्रेड ल्याए टिप्पणी गरे आखिर द डर्टी पिक्चर बाट विद्या उत्कृष्ट अभिनेत्री अवार्ड चुमे की आइतबार आयोजित स्त्रिन अवार्ड समारोह फिल्म बाट उनी मात्रै सम्मानित भइनन् द डर्टी पिक्चर उत्कृष्ट फिल्म ठहरियो द डर्टी पिक्चर उक्त अवार्ड जिन्दगी ना मिलेगी दोबारा सँगै बाँडे निर्देशक एकलौटी गर्यो मिलन लुथरिया उत्कृष्ट निर्देशक दरिए यही फिल्म उ ला ला उ ला ला गीत श्रेया घोषाल उत्कृष्ट गायिका अवार्ड दिलायो त्यसैगरी रकस्टार रणवीर कपुर स्त्रिन अवार्ड उत्कृष्ट स्टार पात्र सांगीतिक उचाइ लिने आकांक्षा आधारित उक्त फिल्म संगीत बाट एआर रहमान फिर से उड चला बाट गायक मोहित चौहान अवार्ड हात पारे सहअभिनेता आरक्षण बाट सैफ अली खान सम्मानित सहअभिनेत्री यह साली जीन्दगी बाट अदिती राव हैदारी बाजी मारिन् महिला खलपात्र खुन माफ बाट पि्रयं चोपडा निर्विवाद बनिन् यसै विधा पुरुष मर्डर बाट प्रशान्त नारायण स्त्रिन अवार्ड जिते
